{
  "schemaVersion": "1.0.0",
  "kind": "review-evidence",
  "reviewId": "fixture-block",
  "operation": "upgrade",
  "project": {
    "manager": {
      "name": "npm",
      "version": "11.19.1",
      "nodeVersion": "24.22.0",
      "entrypoint": "C:/Program Files/nodejs/node_modules/npm/bin/npm-cli.js",
      "platform": "win32",
      "arch": "x64"
    },
    "lockfileVersion": 3,
    "workspaces": false,
    "baseline": "present",
    "protectionsMode": "native"
  },
  "binding": {
    "manifestDigest": "aaaaaaaaaaaaaaaaaaaaaaaaaaaaaaaaaaaaaaaaaaaaaaaaaaaaaaaaaaaaaaaa",
    "lockfileDigest": "bbbbbbbbbbbbbbbbbbbbbbbbbbbbbbbbbbbbbbbbbbbbbbbbbbbbbbbbbbbbbbbb",
    "configDigest": "cccccccccccccccccccccccccccccccccccccccccccccccccccccccccccccccc",
    "graphDigest": "b29beb326f5d505b8410cd3a4f9dcc0e4d1972d71a3799d2f94b08d54d497b2f",
    "policyRevision": "phase0-policy-1",
    "target": "win32-x64"
  },
  "currentBinding": {
    "manifestDigest": "aaaaaaaaaaaaaaaaaaaaaaaaaaaaaaaaaaaaaaaaaaaaaaaaaaaaaaaaaaaaaaaa",
    "lockfileDigest": "bbbbbbbbbbbbbbbbbbbbbbbbbbbbbbbbbbbbbbbbbbbbbbbbbbbbbbbbbbbbbbbb",
    "configDigest": "cccccccccccccccccccccccccccccccccccccccccccccccccccccccccccccccc",
    "graphDigest": "b29beb326f5d505b8410cd3a4f9dcc0e4d1972d71a3799d2f94b08d54d497b2f",
    "policyRevision": "phase0-policy-1",
    "target": "win32-x64"
  },
  "artifacts": [
    {
      "id": "parent",
      "ecosystem": "npm",
      "name": "scouter-fixture-parent",
      "version": "1.0.0",
      "registry": "https://registry.npmjs.org/",
      "resolved": "https://registry.npmjs.org/scouter-fixture-parent/-/scouter-fixture-parent-1.0.0.tgz",
      "integrity": "sha512-AQEBAQEBAQEBAQEBAQEBAQEBAQEBAQEBAQEBAQEBAQEBAQEBAQEBAQEBAQEBAQEBAQEBAQEBAQEBAQEBAQEBAQ==",
      "publishedAt": "2026-09-01T00:00:00.000Z",
      "releaseChannel": "stable",
      "deprecated": false,
      "withdrawn": false,
      "support": "unknown"
    },
    {
      "id": "leaf",
      "ecosystem": "npm",
      "name": "scouter-fixture-leaf",
      "version": "1.0.0",
      "registry": "https://registry.npmjs.org/",
      "resolved": "https://registry.npmjs.org/scouter-fixture-leaf/-/scouter-fixture-leaf-1.0.0.tgz",
      "integrity": "sha512-AgICAgICAgICAgICAgICAgICAgICAgICAgICAgICAgICAgICAgICAgICAgICAgICAgICAgICAgICAgICAgICAg==",
      "publishedAt": "2026-09-01T00:00:00.000Z",
      "releaseChannel": "stable",
      "deprecated": false,
      "withdrawn": false,
      "support": "unknown"
    }
  ],
  "instances": [
    {
      "id": "node_modules/parent",
      "artifactId": "parent",
      "path": "node_modules/parent",
      "direct": true,
      "parentIds": [],
      "dependencyType": "dev"
    },
    {
      "id": "node_modules/leaf",
      "artifactId": "leaf",
      "path": "node_modules/leaf",
      "direct": false,
      "parentIds": [
        "node_modules/parent"
      ],
      "dependencyType": "runtime"
    }
  ],
  "checks": [
    {
      "id": "project:context",
      "category": "context",
      "subject": "project",
      "status": "complete",
      "coverage": "supported",
      "outcome": "clear",
      "source": "fixture:synthetic-evidence",
      "checkedAt": "2026-10-16T17:50:00.000Z",
      "expiresAt": null,
      "details": "Synthetic collector assertion for testing only; no real package was checked."
    },
    {
      "id": "project:graph",
      "category": "graph",
      "subject": "project",
      "status": "complete",
      "coverage": "supported",
      "outcome": "clear",
      "source": "fixture:synthetic-evidence",
      "checkedAt": "2026-10-16T17:50:00.000Z",
      "expiresAt": null,
      "details": "Synthetic collector assertion for testing only; no real package was checked."
    },
    {
      "id": "project:protections",
      "category": "protections",
      "subject": "project",
      "status": "complete",
      "coverage": "supported",
      "outcome": "clear",
      "source": "fixture:synthetic-evidence",
      "checkedAt": "2026-10-16T17:50:00.000Z",
      "expiresAt": null,
      "details": "Synthetic collector assertion for testing only; no real package was checked."
    },
    {
      "id": "project:binding",
      "category": "binding",
      "subject": "project",
      "status": "complete",
      "coverage": "supported",
      "outcome": "clear",
      "source": "fixture:synthetic-evidence",
      "checkedAt": "2026-10-16T17:50:00.000Z",
      "expiresAt": null,
      "details": "Synthetic collector assertion for testing only; no real package was checked."
    },
    {
      "id": "parent:identity",
      "category": "identity",
      "subject": "parent",
      "status": "complete",
      "coverage": "supported",
      "outcome": "clear",
      "source": "fixture:synthetic-evidence",
      "checkedAt": "2026-10-16T17:50:00.000Z",
      "expiresAt": null,
      "details": "Synthetic collector assertion for testing only; no real package was checked."
    },
    {
      "id": "parent:release",
      "category": "release",
      "subject": "parent",
      "status": "complete",
      "coverage": "supported",
      "outcome": "clear",
      "source": "fixture:synthetic-evidence",
      "checkedAt": "2026-10-16T17:50:00.000Z",
      "expiresAt": null,
      "details": "Synthetic collector assertion for testing only; no real package was checked."
    },
    {
      "id": "parent:behavior",
      "category": "behavior",
      "subject": "parent",
      "status": "complete",
      "coverage": "supported",
      "outcome": "clear",
      "source": "fixture:synthetic-evidence",
      "checkedAt": "2026-10-16T17:50:00.000Z",
      "expiresAt": null,
      "details": "Synthetic collector assertion for testing only; no real package was checked."
    },
    {
      "id": "parent:vulnerabilities",
      "category": "vulnerabilities",
      "subject": "parent",
      "status": "complete",
      "coverage": "supported",
      "outcome": "clear",
      "source": "fixture:synthetic-evidence",
      "checkedAt": "2026-10-16T17:50:00.000Z",
      "expiresAt": null,
      "details": "Synthetic collector assertion for testing only; no real package was checked."
    },
    {
      "id": "parent:malware",
      "category": "malware",
      "subject": "parent",
      "status": "complete",
      "coverage": "supported",
      "outcome": "clear",
      "source": "fixture:synthetic-evidence",
      "checkedAt": "2026-10-16T17:50:00.000Z",
      "expiresAt": null,
      "details": "Synthetic collector assertion for testing only; no real package was checked."
    },
    {
      "id": "leaf:identity",
      "category": "identity",
      "subject": "leaf",
      "status": "complete",
      "coverage": "supported",
      "outcome": "clear",
      "source": "fixture:synthetic-evidence",
      "checkedAt": "2026-10-16T17:50:00.000Z",
      "expiresAt": null,
      "details": "Synthetic collector assertion for testing only; no real package was checked."
    },
    {
      "id": "leaf:release",
      "category": "release",
      "subject": "leaf",
      "status": "complete",
      "coverage": "supported",
      "outcome": "clear",
      "source": "fixture:synthetic-evidence",
      "checkedAt": "2026-10-16T17:50:00.000Z",
      "expiresAt": null,
      "details": "Synthetic collector assertion for testing only; no real package was checked."
    },
    {
      "id": "leaf:behavior",
      "category": "behavior",
      "subject": "leaf",
      "status": "complete",
      "coverage": "supported",
      "outcome": "clear",
      "source": "fixture:synthetic-evidence",
      "checkedAt": "2026-10-16T17:50:00.000Z",
      "expiresAt": null,
      "details": "Synthetic collector assertion for testing only; no real package was checked."
    },
    {
      "id": "leaf:vulnerabilities",
      "category": "vulnerabilities",
      "subject": "leaf",
      "status": "complete",
      "coverage": "supported",
      "outcome": "clear",
      "source": "fixture:synthetic-evidence",
      "checkedAt": "2026-10-16T17:50:00.000Z",
      "expiresAt": null,
      "details": "Synthetic collector assertion for testing only; no real package was checked."
    },
    {
      "id": "leaf:malware",
      "category": "malware",
      "subject": "leaf",
      "status": "complete",
      "coverage": "supported",
      "outcome": "clear",
      "source": "fixture:synthetic-evidence",
      "checkedAt": "2026-10-16T17:50:00.000Z",
      "expiresAt": null,
      "details": "Synthetic collector assertion for testing only; no real package was checked."
    }
  ],
  "findings": [
    {
      "id": "finding-1",
      "artifactId": "leaf",
      "evidenceId": "leaf:vulnerabilities",
      "type": "vulnerability",
      "severity": "high",
      "confirmation": "verified",
      "applicability": "affected",
      "mitigated": false,
      "description": "Synthetic advisory"
    }
  ]
}
